{
  "id": "01KV0FPMC6BAB57KN5R3545NED",
  "kind": "constraint",
  "scope": ".",
  "subject": "Lightweight: no heavy runtime or bundled LLM calls",
  "reason": "Core principle from AGENTS.md: no surprise transitive dependencies, no background processes",
  "source_type": "human",
  "author": "maintainer",
  "created_at": "2026-06-06T00:00:00Z",
  "last_verified_at": "2026-06-13T00:00:00Z",
  "status": "active"
}