{
  "id": "01KV0FPMC6K6K6BSNJTPS5WC41",
  "kind": "constraint",
  "scope": ".",
  "subject": "English-only: no mixed-language commits",
  "reason": "Core principle from AGENTS.md: documentation, code, comments, and resource files are in English only",
  "source_type": "human",
  "author": "maintainer",
  "created_at": "2026-06-06T00:00:00Z",
  "last_verified_at": "2026-06-13T00:00:00Z",
  "status": "active"
}