{
  "id": "01KV0FPMC74J3KGX10BPMZAR4Q",
  "kind": "decision",
  "scope": "go.mod",
  "subject": "Use Go as primary language for v0",
  "reason": "Self-contained single binary, mature CLI ecosystem (cobra, gh, kubectl), cheaper to ship than Rust/Node/Python for v0",
  "source_type": "human",
  "author": "maintainer",
  "created_at": "2026-06-06T00:00:00Z",
  "last_verified_at": "2026-06-13T00:00:00Z",
  "status": "active"
}