{
  "id": "01HW4F2N8X2JZPM7Q3S5V0K1A0",
  "kind": "decision",
  "scope": "src/billing/**",
  "subject": "Use ledger-based accounting",
  "body": "We evaluated double-entry vs ledger; the team has more ledger experience.",
  "reason": "Team expertise and audit requirements",
  "evidence": ["docs/adr/0007-ledger.md"],
  "source_type": "human",
  "author": "alice",
  "created_at": "2026-01-15T10:00:00Z",
  "last_verified_at": "2026-05-01T10:00:00Z",
  "status": "active",
  "decided_at": "2026-01-10T10:00:00Z",
  "tags": ["accounting", "architecture"],
  "rejected_alternatives": ["double-entry bookkeeping"]
}
