{
  "id": "01KV0FPMC5VXTJ6SSEEKF1CQB6",
  "kind": "constraint",
  "scope": ".",
  "subject": "Non-intrusive: never edit the host agent",
  "reason": "Core principle from AGENTS.md: observe and record only; redesign any feature that requires touching the host",
  "source_type": "human",
  "author": "maintainer",
  "created_at": "2026-06-06T00:00:00Z",
  "last_verified_at": "2026-06-13T00:00:00Z",
  "status": "active"
}