{
  "id": "01KV0FPMC6VDWPHFNPYE2ZB7N8",
  "kind": "constraint",
  "scope": ".",
  "subject": "Cross-platform: macOS, Linux, Windows",
  "reason": "Core principle from AGENTS.md: no platform-specific paths, syscalls, or shell calls without abstraction layer",
  "source_type": "human",
  "author": "maintainer",
  "created_at": "2026-06-06T00:00:00Z",
  "last_verified_at": "2026-06-13T00:00:00Z",
  "status": "active"
}