{
  "id": "01KV0FPMC7MSKFD8V08203DWBB",
  "kind": "decision",
  "scope": "go.mod",
  "subject": "Use jsonschema/v5 for Draft 2020-12 validation",
  "reason": "Go-native, widely-used library; schema is embedded via //go:embed and compiled once in init()",
  "source_type": "human",
  "author": "maintainer",
  "created_at": "2026-06-06T00:00:00Z",
  "last_verified_at": "2026-06-13T00:00:00Z",
  "status": "active"
}