{
  "id": "01KV0FPMC84FVHJ282NZFBCT6Y",
  "kind": "decision",
  "scope": "internal/storage/",
  "subject": "Store layout: per-kind directories, ULID+slug filenames",
  "reason": "Read-heavy, human-readable, human-editable; git-friendly; one JSON file per record",
  "source_type": "human",
  "author": "maintainer",
  "created_at": "2026-06-06T00:00:00Z",
  "last_verified_at": "2026-06-13T00:00:00Z",
  "status": "active"
}